{
  "id": "releases/2026-01-05/species/EX1.json",
  "kind": "species",
  "format": "species/1.2",
  "provenance": {
    "release": "2026-01-05",
    "sources": ["example"],
    "licences": ["CC-BY-4.0"],
    "gbif_download_dois": ["10.0000/example"],
    "method": "test-1",
    "taxonomy": "test-taxonomy",
    "boundaries": "test-boundaries",
    "ranges": null,
    "protection": null,
    "code": "0.0.0",
    "run": "run-1"
  },
  "data": {
    "species_key": "EX1",
    "scientific_name": "Exemplum primum",
    "authorship": null,
    "common_name": null,
    "synonyms": [],
    "rank": "species",
    "classification": {
      "kingdom": "Animalia",
      "phylum": null,
      "class": null,
      "order": null,
      "family": null,
      "genus": "Exemplum"
    },
    "group": "birds",
    "slug": "exemplum-primum",
    "areas": [
      {
        "area": "us-zz",
        "level": "state",
        "records": 120,
        "season": [14, 22, 35],
        "season_withheld": null
      }
    ],
    "ranges": [],
    "statuses": [
      {
        "list": "usfws",
        "place": "us",
        "listed_name": "Exemplum primum",
        "status": "Threatened",
        "where": "Wherever found"
      }
    ],
    "introductions": [
      {
        "source": "us-riis-l48-v2",
        "region": "us-l48",
        "listed_name": "Exemplum primum",
        "status": "invasive"
      }
    ]
  }
}
